{"memory_id":"55555555-5555-4555-8555-555555555555","namespace_id":"usr_Example1:char_miku","user_id":"22222222-2222-4222-8222-222222222222","character_id":"miku","type":"inferred","subject":"user","predicate":"prefers_language","value":"ko","confidence":0.96,"importance":0.6,"status":"active","evidence":[{"evidence_id":"66666666-6666-4666-8666-666666666666","kind":"repeated_observation","reference":"session-events:example"}],"created_by":"model","created_at":"2026-09-02T00:00:00Z","updated_at":"2026-09-02T00:00:00Z","revision":1,"supersedes":[],"observation_count":3,"first_seen":"2026-08-01T00:00:00Z","last_seen":"2026-09-02T00:00:00Z"}
